{
  "schemaVersion": 2,
  "id": "baseball-analytics",
  "title": "Baseball Analytics — Performance & Strategy Optimization",
  "durationHours": 168,
  "envelopes": [
    {
      "envelopeId": "ENV-BB-001",
      "name": "Player Performance Analysis",
      "domain": "Performance Analytics",
      "ownerRole": "Performance Steward",
      "createdHour": 0,
      "endHour": 84,
      "accent": "var(--vscode-charts-blue)",
      "envelope_version": 1,
      "revision_id": null,
      "assumptions": [
        "Performance models trained on Statcast data and historical player metrics.",
        "Analysis considers both traditional stats and advanced metrics (xwOBA, barrel rate, sprint speed).",
        "Recommendations balance current performance with projected development curves."
      ],
      "constraints": [
        "Never recommend roster moves based solely on small sample sizes (<50 PA/IP)",
        "Performance projections must include confidence intervals",
        "Age and injury history factored into long-term recommendations"
      ]
    },
    {
      "envelopeId": "ENV-BB-002",
      "name": "In-Game Strategy & Lineup Optimization",
      "domain": "Game Strategy",
      "ownerRole": "Strategy Steward",
      "createdHour": 0,
      "endHour": 120,
      "accent": "var(--vscode-charts-orange)",
      "envelope_version": 2,
      "revision_id": "REV-BB-002-B",
      "assumptions": [
        "Lineup optimization maximizes run expectancy based on matchup data.",
        "Bullpen usage balances win probability with pitcher rest requirements.",
        "Real-time strategy adjustments react to game state and opposing decisions."
      ],
      "constraints": [
        "Never suggest overusing relievers — max 3 appearances in 5 days",
        "Starting pitcher recommendations respect pitch count limits (100 pitches typical)",
        "Defensive shifts must account for runner-on-base scenarios"
      ]
    },
    {
      "envelopeId": "ENV-BB-003",
      "name": "Injury Risk & Load Management",
      "domain": "Player Health",
      "ownerRole": "Health Steward",
      "createdHour": 12,
      "endHour": 156,
      "accent": "var(--vscode-charts-red)",
      "envelope_version": 1,
      "revision_id": null,
      "assumptions": [
        "Biomechanics data and workload tracking predict injury risk.",
        "Rest recommendations balance player availability with injury prevention.",
        "Medical staff has final authority on playing status."
      ],
      "constraints": [
        "High injury risk flags require medical evaluation before clearance",
        "Pitcher workload limits enforced (innings pitched, pitch counts, rest days)",
        "Position player fatigue monitored via sprint speed and exit velocity decline"
      ]
    },
    {
      "envelopeId": "ENV-BB-004",
      "name": "Roster Construction & Trade Analysis",
      "domain": "Roster Management",
      "ownerRole": "Roster Steward",
      "createdHour": 0,
      "endHour": 60,
      "accent": "var(--vscode-charts-green)",
      "envelope_version": 3,
      "revision_id": "REV-BB-004-C",
      "assumptions": [
        "Trade value models consider contract, age, performance, and positional scarcity.",
        "Prospect projections based on minor league performance and scouting reports.",
        "Roster optimization balances win-now vs. long-term competitive windows."
      ],
      "constraints": [
        "Trade recommendations must fit within salary cap constraints",
        "Never recommend trading away controllable young talent without GM approval",
        "40-man roster and option limits enforced in all roster suggestions"
      ]
    },
    {
      "envelopeId": "ENV-BB-001",
      "name": "Player Performance Analysis",
      "domain": "Performance Analytics",
      "ownerRole": "Performance Steward",
      "createdHour": 144,
      "endHour": 168,
      "accent": "var(--vscode-charts-blue)",
      "envelope_version": 2,
      "revision_id": "ENV-BB-001-v2",
      "assumptions": [
        "Performance models trained on Statcast data and historical player metrics.",
        "Analysis considers both traditional stats and advanced metrics (xwOBA, barrel rate, sprint speed).",
        "Recommendations balance current performance with projected development curves."
      ],
      "constraints": [
        "Never recommend roster moves based solely on small sample sizes (<50 PA/IP)",
        "Performance projections must include confidence intervals",
        "Age and injury history factored into long-term recommendations"
      ]
    },
    {
      "envelopeId": "ENV-BB-002",
      "name": "In-Game Strategy & Lineup Optimization",
      "domain": "Game Strategy",
      "ownerRole": "Strategy Steward",
      "createdHour": 144,
      "endHour": 168,
      "accent": "var(--vscode-charts-orange)",
      "envelope_version": 3,
      "revision_id": "ENV-BB-002-v3",
      "assumptions": [
        "Lineup optimization maximizes run expectancy based on matchup data.",
        "Bullpen usage balances win probability with pitcher rest requirements.",
        "Real-time strategy adjustments react to game state and opposing decisions."
      ],
      "constraints": [
        "Never suggest overusing relievers — max 3 appearances in 5 days",
        "Starting pitcher recommendations respect pitch count limits (100 pitches typical)",
        "Defensive shifts must account for runner-on-base scenarios"
      ]
    },
    {
      "envelopeId": "ENV-BB-004",
      "name": "Roster Construction & Trade Analysis",
      "domain": "Roster Management",
      "ownerRole": "Roster Steward",
      "createdHour": 140,
      "endHour": 168,
      "accent": "var(--vscode-charts-green)",
      "envelope_version": 4,
      "revision_id": "ENV-BB-004-v4",
      "assumptions": [
        "Trade value models consider contract, age, performance, and positional scarcity.",
        "Prospect projections based on minor league performance and scouting reports.",
        "Roster optimization balances win-now vs. long-term competitive windows."
      ],
      "constraints": [
        "Trade recommendations must fit within salary cap constraints",
        "Never recommend trading away controllable young talent without GM approval",
        "40-man roster and option limits enforced in all roster suggestions"
      ]
    }
  ],
  "fleets": [
    {
      "stewardRole": "Performance Steward",
      "agents": [
        {
          "agentId": "AG-PERF-01",
          "name": "BattingAnalyzer",
          "role": "hitting performance evaluation and projections",
          "envelopeIds": ["ENV-BB-001"]
        },
        {
          "agentId": "AG-PERF-02",
          "name": "PitchingAnalyzer",
          "role": "pitching performance and arsenal optimization",
          "envelopeIds": ["ENV-BB-001"]
        },
        {
          "agentId": "AG-PERF-03",
          "name": "DefenseEvaluator",
          "role": "fielding metrics and positioning analysis",
          "envelopeIds": ["ENV-BB-001"]
        }
      ]
    },
    {
      "stewardRole": "Strategy Steward",
      "agents": [
        {
          "agentId": "AG-STRAT-01",
          "name": "LineupOptimizer",
          "role": "batting order and platoon matchup optimization",
          "envelopeIds": ["ENV-BB-002"]
        },
        {
          "agentId": "AG-STRAT-02",
          "name": "BullpenManager",
          "role": "relief pitcher usage and matchup recommendations",
          "envelopeIds": ["ENV-BB-002"]
        },
        {
          "agentId": "AG-STRAT-03",
          "name": "ShiftAdvisor",
          "role": "defensive positioning based on spray charts",
          "envelopeIds": ["ENV-BB-002"]
        }
      ]
    },
    {
      "stewardRole": "Health Steward",
      "agents": [
        {
          "agentId": "AG-HEALTH-01",
          "name": "BiomechanicsMonitor",
          "role": "pitcher mechanics and injury risk assessment",
          "envelopeIds": ["ENV-BB-003"]
        },
        {
          "agentId": "AG-HEALTH-02",
          "name": "WorkloadTracker",
          "role": "fatigue detection and rest recommendations",
          "envelopeIds": ["ENV-BB-003"]
        },
        {
          "agentId": "AG-HEALTH-03",
          "name": "RecoveryOptimizer",
          "role": "rehabilitation protocol recommendations",
          "envelopeIds": ["ENV-BB-003"]
        }
      ]
    },
    {
      "stewardRole": "Roster Steward",
      "agents": [
        {
          "agentId": "AG-ROSTER-01",
          "name": "TradeEvaluator",
          "role": "trade value and team fit analysis",
          "envelopeIds": ["ENV-BB-004"]
        },
        {
          "agentId": "AG-ROSTER-02",
          "name": "ProspectProjector",
          "role": "minor league player development forecasting",
          "envelopeIds": ["ENV-BB-004"]
        },
        {
          "agentId": "AG-ROSTER-03",
          "name": "ContractOptimizer",
          "role": "salary allocation and arbitration analysis",
          "envelopeIds": ["ENV-BB-004"]
        }
      ]
    }
  ],
  "events": [
    {
      "eventId": "envelope_promoted:0:ENV-BB-001:0",
      "hour": 0,
      "type": "envelope_promoted",
      "envelopeId": "ENV-BB-001",
      "severity": "info",
      "label": "Envelope promoted",
      "detail": "Player performance analysis envelope activated for season with updated Statcast integration.",
      "actorRole": "Performance Steward",
      "actorName": "Sarah Chen"
    },
    {
      "eventId": "envelope_promoted:0:ENV-BB-002:1",
      "hour": 0,
      "type": "envelope_promoted",
      "envelopeId": "ENV-BB-002",
      "severity": "info",
      "label": "Envelope promoted",
      "detail": "In-game strategy envelope (REV-BB-002-B) activated with refined bullpen usage algorithms.",
      "actorRole": "Strategy Steward",
      "actorName": "Marcus Johnson"
    },
    {
      "eventId": "decision:3_5:ENV-BB-002:2",
      "hour": 3.5,